Option,Hazards,Assets,Action Type,Sub-Action Type,Source Plan,URL,Toolkit Case Study
Develop a new water source that benefits the commercial activity of the community as well as community health and safety.,"Water Quality,Drought","Water Infrastructure – Drinking Water,Economy",Capital Improvements - Green & Gray Infrastructure,Water Infrastructure,"Climate Change in Port Heiden, AK",https://anthc.org/wp-content/uploads/2018/10/ANTHC-Port-Heiden_Final.pdf,https://toolkit.climate.gov/case-studies/climate-change-port-heiden-ak-1
Develop a notification system for natural hazards that is responsive to community needs.,"Air Quality,High Winds,Landslides,Multiple or All Hazards,Severe Winter Weather,Water Quality,Wildfire,Erosion and Shoreline Recession,Extreme Heat,Flooding – Coastal,Flooding – General","Multiple or All Assets,People",Preparedness & Response,Early warning,Statewide Summary Report: California's Fourth Climate Change Assessment,https://resilientca.org/ ,https://toolkit.climate.gov/case-studies/statewide-summary-report-californias-fourth-climate-change-assessment-1
"Develop a plan for communicating to the public about seawall projects (e.g., why are they needed, where are they needed).",Flooding – Coastal,Property,"""Policy, Codes, & Standards""",Building Codes,"West Palm Beach, FL - Rethink Paradise: Sustainability Action Plan",https://www.wpb.org/home/showpublisheddocument/7079/638446312959930000,https://toolkit.climate.gov/case-studies/west-palm-beach-fl-rethink-paradise-sustainability-action-plan-1
"Develop a program that addresses fire mitigation through access, signage, fire hydrants, water availability, vegetation management, and special building construction standards. ",Wildfire,Multiple or All Assets,Preparedness & Response,Emergency Management,HUD Community Resilience Toolkit,https://www.hudexchange.info/resource/5981/community-resilience-toolkit/,https://toolkit.climate.gov/case-studies/hud-community-resilience-toolkit-0
Develop a program to buy out repetitive loss and high-risk properties.,"Flooding – General,Flooding – Rainfall-induced",Property,"""Managed Retreat, Relocation, & Buyout""",Buyouts,"Planning for Climate Resilience | City of Asheville, North Carolina",https://drive.google.com/file/d/1X_Gr4eUCmkXPOzAcvyxCe-uZPkX84Byz/view,https://toolkit.climate.gov/case-studies/planning-future-floodplain
"Develop a program to implement flood preparedness and damage reduction measures in the Community Rating System. Efforts could focus on acquisition, relocation, retrofitting and maintenance of drainage ways and retention basins. Depending on the extent of activities, local flood insurance premiums may be reduced. ",Flooding – General,Multiple or All Assets,Preparedness & Response,Emergency Management,HUD Community Resilience Toolkit,https://www.hudexchange.info/resource/5981/community-resilience-toolkit/,https://toolkit.climate.gov/case-studies/hud-community-resilience-toolkit-0
Develop a program to remove invasive plants to avoid competition during extreme drought or wet periods.,"Drought,Flooding – Coastal,Flooding – General","Urban Landscape and Tree Canopy,Aquatic and Marine Resources,Natural Areas and Wildlife",Capacity Building,"""Community Resources, Transformative Strategies, Resilience Hubs""","Triangle Region, NC Regional Resilience Assessment",https://www.tjcog.org/focus-areas-environment-resilience-climate-and-energy/triangle-regional-resilience-partnership,https://toolkit.climate.gov/case-studies/triangle-region-nc-regional-resilience-assessment-0
Develop a protection plan and implement reinforcement measures for high-risk areas. (Strategy: Manage development in high-risk areas),Erosion and Shoreline Recession,Property,Planning & Management,Planning,HUD Community Resilience Toolkit,https://www.hudexchange.info/resource/5981/community-resilience-toolkit/,https://toolkit.climate.gov/case-studies/hud-community-resilience-toolkit-0
Develop a regional approach to monitoring conditions of dams and berms.,"Erosion and Shoreline Recession,Flooding – General,Flooding – Rainfall-induced",Water Infrastructure – Stormwater,Capacity Building,"""Data Collection, Analysis, Research, Assess Vulnerability & Risk""","Triangle Region, NC Regional Resilience Assessment",https://www.tjcog.org/focus-areas-environment-resilience-climate-and-energy/triangle-regional-resilience-partnership,https://toolkit.climate.gov/case-studies/triangle-region-nc-regional-resilience-assessment-0
"Develop a retrofit program to provide incentives for property owners to reduce their own risk. Low_interest capital and a potential reduction in insurance premiums are example incentives. Resilience improvements might include elevation, floodproofing, storm shutters or stormwater management efforts.",Flooding – General,"Multiple or All Assets,Property",Funding & Finance,Financing & Incentives,LA SAFE Regional Adaptation Strategy,https://s3.amazonaws.com/lasafe/Final+Adaptation+Strategies/Regional+Adaptation+Strategy.pdf,https://toolkit.climate.gov/case-studies/la-safe-regional-adaptation-strategy-1
Develop a sea level rise strategy for the community or region. Include the most recent sea level rise projections. Conduct a regular review of the strategy.,Flooding – Coastal,Multiple or All Assets,Capacity Building,"""Monitoring, Inspection and Maintenance""","Charleston, South Carolina - All Hazards Vulnerability & Risk Assessment",https://www.charleston-sc.gov/1975/All-Hazards-Vulnerability-Risk-Assessmen,https://toolkit.climate.gov/case-studies/charleston-south-carolina-all-hazards-vulnerability-risk-assessment-1
Develop a spatial database of resilience projects for water infrastructure. Track the climate resilience projects being designed and built. ,"Water Quality,Flooding – General","Water Infrastructure – Drinking Water,Water Infrastructure – General,Water Infrastructure – Stormwater",Capacity Building,"""Data Collection, Analysis, Research, Assess Vulnerability & Risk""",Southeast Florida Compact Regional Climate Action Plan - Energy and Fuel,http://www.southeastfloridaclimatecompact.org/recommendation-category/ef/,https://toolkit.climate.gov/case-studies/southeast-florida-compact-regional-climate-action-plan-energy-and-fuel-0
Develop a stormwater response plan to clear inlets and outlets before and during events. Ensure the document plans for having teams on stand-by.,"Flooding – General,Flooding – Rainfall-induced",Water Infrastructure – Stormwater,Planning & Management,Planning,"Charleston, South Carolina - All Hazards Vulnerability & Risk Assessment",https://www.charleston-sc.gov/1975/All-Hazards-Vulnerability-Risk-Assessmen,https://toolkit.climate.gov/case-studies/charleston-south-carolina-all-hazards-vulnerability-risk-assessment-1
Develop a study to look at drought and expected water supply in the future (50 years) given new data since the WEAP Modeling effort,Drought,Water Infrastructure – General,Capacity Building,"""Data Collection, Analysis, Research, Assess Vulnerability & Risk""","West Palm Beach, FL - Rethink Paradise: Sustainability Action Plan",https://www.wpb.org/home/showpublisheddocument/7079/638446312959930000,https://toolkit.climate.gov/case-studies/west-palm-beach-fl-rethink-paradise-sustainability-action-plan-1
Develop a toilet retrofit program with an emphasis on serving low-income households. Such programs feature a rebate to customers that purchase and install a low flow toilet that uses 1.28 gallons per flush. Increasing water use efficiency can prevent or alleviate drought impacts.,Drought,"Water Infrastructure – Wastewater,Property",Funding & Finance,Financing & Incentives,"Phoenix, AZ Climate Action Plan",https://www.phoenix.gov/oepsite/Documents/2021ClimateActionPlanEnglish.pdf,https://toolkit.climate.gov/case-studies/phoenix-az-climate-action-plan-1
Develop a watershed plan to guide infrastructure and improvement projects. Watershed plans can influence zoning and prompt infrastructure evaluations and stream restoration. ,"Water Quality,Flooding – General,Flooding – Rainfall-induced","Aquatic and Marine Resources,Property,Water Infrastructure – Stormwater",Planning & Management,Planning,"Planning for Climate Resilience | City of Asheville, North Carolina",https://drive.google.com/file/d/1X_Gr4eUCmkXPOzAcvyxCe-uZPkX84Byz/view,https://toolkit.climate.gov/case-studies/planning-future-floodplain
Develop agreements with Uber and other ride share platform drivers to provide emergency egress and evacuation services to residents and community visitors vulnerable to road access issues.,"High Winds,Landslides,Flooding – General,Flooding – Rainfall-induced",Transportation and Mobility,Partnerships & Collaboration,Partnerships,"Triangle Region, NC Regional Resilience Assessment",https://www.tjcog.org/focus-areas-environment-resilience-climate-and-energy/triangle-regional-resilience-partnership,https://toolkit.climate.gov/case-studies/triangle-region-nc-regional-resilience-assessment-0
Develop an adaptive management plan to address the long-term impacts of sea level rise.,Flooding – Coastal,"Transportation and Mobility,Multiple or All Assets",Planning & Management,Planning,Statewide Summary Report: California's Fourth Climate Change Assessment,https://resilientca.org/ ,https://toolkit.climate.gov/case-studies/statewide-summary-report-californias-fourth-climate-change-assessment-1
Develop an air quality mapping program at the neighborhood level.,Air Quality,People,Capacity Building,"""Community Resources, Transformative Strategies, Resilience Hubs""","Columbus, OH Climate Action Plan",https://byrd.osu.edu/sites/byrd.osu.edu/files/CCCAP%20-%20FINAL_0.pdf,https://toolkit.climate.gov/case-studies/columbus-oh-climate-action-plan-0
Develop an ecosystem fire recovery master plan to address revegetation and post-fire treatments for open space and community parks. The plan could outline implementation actions for protecting and improving ecosystem health.,Wildfire,"Urban Landscape and Tree Canopy,Aquatic and Marine Resources,Natural Areas and Wildlife",Planning & Management,Planning,Climate Resilient San Diego,https://www.sandiego.gov/sites/default/files/crsd_final_plan_with_appendices.pdf,https://toolkit.climate.gov/case-studies/climate-resilient-san-diego-1
Develop an education campaign to keep plastic out of waterways and lagoons. ,Water Quality,"Aquatic and Marine Resources,Natural Areas and Wildlife",Public Education & Outreach,Education,"West Palm Beach, FL - Rethink Paradise: Sustainability Action Plan",https://www.wpb.org/home/showpublisheddocument/7079/638446312959930000,https://toolkit.climate.gov/case-studies/west-palm-beach-fl-rethink-paradise-sustainability-action-plan-1
"Develop an educational campaign that encourages residents to weatherize their homes. Doing so will reduce heating and cooling bills, especially as high temperature days and nights become more common.","Severe Winter Weather,Extreme Heat","Energy and Utilities,Property",Public Education & Outreach,Community Engagement,"Missoula, MT Regional Adaptation Strategy",https://www.climatereadymissoula.org/uploads/1/2/6/6/126687164/revisedclimatereadymissoula_2.22.20.pdf,https://toolkit.climate.gov/case-studies/missoula-mt-regional-adaptation-strategy-0
Develop an incentive program to convert fuelburning lawn equipment such as gas-powered lawn mowers and blowers to electric. ,Air Quality,People,Funding & Finance,Financing & Incentives,Ashland Climate and Energy Action Plan,https://ashlandor.org/wp-content/uploads/Ashland-Climate-and-Energy-Action-Plan_pages.pdf,https://toolkit.climate.gov/case-studies/ashland-climate-and-energy-action-plan
"Develop an ongoing buyouts program that would re-purpose properties at high-risk of sea level rise impacts. Use the land to support water management, drainage and absorption. ","Erosion and Shoreline Recession,Flooding – Coastal",Property,"""Managed Retreat, Relocation, & Buyout""",Buyouts,HUD Community Resilience Toolkit,https://www.hudexchange.info/resource/5981/community-resilience-toolkit/,https://toolkit.climate.gov/case-studies/hud-community-resilience-toolkit-0
"Develop an open space acquisition, reuse and preservation program targeting flood hazard areas. ",Flooding – General,Property,"""Managed Retreat, Relocation, & Buyout""",Relocation,HUD Community Resilience Toolkit,https://www.hudexchange.info/resource/5981/community-resilience-toolkit/,https://toolkit.climate.gov/case-studies/hud-community-resilience-toolkit-0
Develop and adopt a cohesive regional stormwater ordinance. Include baseline best practices and the option for communities to go beyond minimum requirements.,"Flooding – General,Flooding – Rainfall-induced",Water Infrastructure – Stormwater,"""Policy, Codes, & Standards""",Building Codes,Miami Forever Climate Ready Strategy,https://www.miami.gov/My-Government/ClimateChange/Climate-Change-Action/MiamiForeverClimateReady,https://toolkit.climate.gov/case-studies/miami-forever-climate-ready-strategy-0
"Develop and communicate water-use best practices for agricultural producers in real time to inform plant and animal water needs, improve efficiency and reduce water loss. ",Drought,Agriculture and Food Supply,Public Education & Outreach,Community Engagement,"Missoula, MT Regional Adaptation Strategy",https://www.climatereadymissoula.org/uploads/1/2/6/6/126687164/revisedclimatereadymissoula_2.22.20.pdf,https://toolkit.climate.gov/case-studies/missoula-mt-regional-adaptation-strategy-0
Develop and implement a jurisdiction-wide green infrastructure plan that supports vegetation-based stormwater management best practices and strategies for managing urban heat.,"Water Quality,Extreme Heat,Flooding – General","Urban Landscape and Tree Canopy,Water Infrastructure – Stormwater",Planning & Management,Planning,Detroit Climate Action Plan,https://detroitenvironmentaljustice.org/wp-content/uploads/2017/10/CAP_WEB.pdf,https://toolkit.climate.gov/case-studies/detroit-climate-action-plan-1
Develop and implement an open space plan.,"""Shifting Species, Habitats, and Ecosystems""","Urban Landscape and Tree Canopy,Aquatic and Marine Resources,Natural Areas and Wildlife",Planning & Management,Planning,Detroit Climate Action Plan,https://detroitenvironmentaljustice.org/wp-content/uploads/2017/10/CAP_WEB.pdf,https://toolkit.climate.gov/case-studies/detroit-climate-action-plan-1
Develop and implement localized adaptation strategies for areas of greatest climate-related vulnerability. ,Multiple or All Hazards,Multiple or All Assets,Capacity Building,"""Community Resources, Transformative Strategies, Resilience Hubs""",Southeast Florida Compact Regional Climate Action Plan - Energy and Fuel,http://www.southeastfloridaclimatecompact.org/recommendation-category/ef/,https://toolkit.climate.gov/case-studies/southeast-florida-compact-regional-climate-action-plan-energy-and-fuel-0
"Develop and implement long-term, sustainable and regional solutions to beach erosion and sediment supply. Align local and regional beach erosion prevention efforts with regional and state plans.",Erosion and Shoreline Recession,"Aquatic and Marine Resources,Natural Areas and Wildlife",Capacity Building,"""Data Collection, Analysis, Research, Assess Vulnerability & Risk""",Southeast Florida Compact Regional Climate Action Plan - Energy and Fuel,http://www.southeastfloridaclimatecompact.org/recommendation-category/ef/,https://toolkit.climate.gov/case-studies/southeast-florida-compact-regional-climate-action-plan-energy-and-fuel-0
"Develop and promote an educational campaign to build a shared understanding of the value of urban forests and encourage planting appropriate species, watering and care.  ","Air Quality,Landslides,""Shifting Species, Habitats, and Ecosystems"",Drought,Flooding – General",Urban Landscape and Tree Canopy,Public Education & Outreach,Education,"Missoula, MT Regional Adaptation Strategy",https://www.climatereadymissoula.org/uploads/1/2/6/6/126687164/revisedclimatereadymissoula_2.22.20.pdf,https://toolkit.climate.gov/case-studies/missoula-mt-regional-adaptation-strategy-0
"Develop and promote educational materials on the health impacts of air pollution, wildfire smoke, extreme heat, longer allergy seasons and vector-borne diseases. Focus on how to limit exposure to sensitive populations and why it matters. Ensure materials include information about the best health practices during concurrent heat and smoke events. ","Air Quality,Vector-Borne Disease,Wildfire,Changing Seasons,Extreme Heat",People,Public Education & Outreach,Education,"St Paul, MN Climate Action & Resilience Plan, Missoula, MT Regional Adaptation Strategy",,
"Develop and regularly update a coastal erosion assessment to track conditions of coastline bluffs, beaches, access stairs, ramps, outfalls, seawalls or other related infrastructure. ",Erosion and Shoreline Recession,"Water Infrastructure – Wastewater,Natural Areas and Wildlife",Capacity Building,"""Data Collection, Analysis, Research, Assess Vulnerability & Risk""",Climate Resilient San Diego,https://www.sandiego.gov/sites/default/files/crsd_final_plan_with_appendices.pdf,https://toolkit.climate.gov/case-studies/climate-resilient-san-diego-1
"Develop and share new information, methods, technical capabilities and trends that address key climate impact concerns.",Multiple or All Hazards,People,,,Southeast Florida Compact Regional Climate Action Plan - Energy and Fuel,http://www.southeastfloridaclimatecompact.org/recommendation-category/ef/,https://toolkit.climate.gov/case-studies/southeast-florida-compact-regional-climate-action-plan-energy-and-fuel-0
Develop and track indicators of climate change impacts and successes of adaptation actions.,Multiple or All Hazards,Multiple or All Assets,Capacity Building,"""Data Collection, Analysis, Research, Assess Vulnerability & Risk""",Southeast Florida Compact Regional Climate Action Plan - Energy and Fuel,http://www.southeastfloridaclimatecompact.org/recommendation-category/ef/,https://toolkit.climate.gov/case-studies/southeast-florida-compact-regional-climate-action-plan-energy-and-fuel-0
Develop and update regional water models. Ensure water management models account for future climate conditions. ,Drought,"Agriculture and Food Supply,Water Infrastructure – Drinking Water,Aquatic and Marine Resources,Multiple or All Assets,Water Infrastructure – Stormwater",Capacity Building,"""Data Collection, Analysis, Research, Assess Vulnerability & Risk""",Southeast Florida Compact Regional Climate Action Plan - Energy and Fuel,http://www.southeastfloridaclimatecompact.org/recommendation-category/ef/,https://toolkit.climate.gov/case-studies/southeast-florida-compact-regional-climate-action-plan-energy-and-fuel-0
Develop communitywide equity indicators to inform and measure inclusive investments and policy-making.,Multiple or All Hazards,People,Capacity Building,"""Data Collection, Analysis, Research, Assess Vulnerability & Risk""","Los Angeles, CA Resilience Strategy",https://resilientcitiesnetwork.org/downloadable_resources/Network/Los-Angeles-Resilience-Strategy-English.pdf,https://toolkit.climate.gov/case-studies/los-angeles-ca-resilience-strategy-0
Develop cross boundary watershed solutions.,Multiple or All Hazards,Multiple or All Assets,Capacity Building,Governance Capacity Building,"Triangle Region, NC Regional Resilience Assessment",https://www.tjcog.org/focus-areas-environment-resilience-climate-and-energy/triangle-regional-resilience-partnership,https://toolkit.climate.gov/case-studies/triangle-region-nc-regional-resilience-assessment-0
Develop education/outreach materials and training regarding climate adaptationforestry specific for Vermont forest types and conditions. ,"""Shifting Species, Habitats, and Ecosystems""",Natural Areas and Wildlife,Public Education & Outreach,Education,Vermont Climate Action Plan,https://outside.vermont.gov/agency/anr/climatecouncil/Shared%20Documents/Initial%20Climate%20Action%20Plan%20-%20Final%20-%2012-1-21.pdf,https://toolkit.climate.gov/case-studies/vermont-climate-action-plan-1
Develop flood risk mapping system (assessment) or process that is tailored to specific needs and is frequently updated. This can be used to point citizens to the most accurate elevation data for their parcels or a process for understanding their parcels' true elevation. This system would then lead to more informed management decisions and greater citizen outreach and education opportunities as well as the possibility of lower flood insurance premiums.,Flooding – Rainfall-induced,Property,Capacity Building,"""Data Collection, Analysis, Research, Assess Vulnerability & Risk""","Triangle Region, NC Regional Resilience Assessment",https://www.tjcog.org/focus-areas-environment-resilience-climate-and-energy/triangle-regional-resilience-partnership,https://toolkit.climate.gov/case-studies/triangle-region-nc-regional-resilience-assessment-0
Develop flood risk mapping system or process that is tailored to specific needs and is frequently updated. Use it to point citizens to the most accurate elevation data for their parcels or a process for understanding their parcels’ true elevation. This system would then lead to more informed management decisions and greater citizen outreach and education opportunities as well as the possibility of lower flood insurance premiums.,Flooding – General,Multiple or All Assets,Public Education & Outreach,Community Engagement,"City of Alexandria, Virginia Energy & Climate Change Action Plan",https://www.alexandriava.gov/energy/energy-and-climate-change-action-plan,https://toolkit.climate.gov/case-studies/city-alexandria-virginia-energy-climate-change-action-plan-1
Develop incentives or regulations for property owners to improve the resilience of buildings in areas facing increased risk of flooding.,Flooding – General,Multiple or All Assets,Funding & Finance,Financing & Incentives,"Denver, CO Climate Action Plan",https://denvergov.org/files/assets/public/climate-action/cpf_fiveyearplan_final.pdf,https://toolkit.climate.gov/case-studies/denver-co-climate-action-plan-0
Develop mechanisms to alert and protect outdoor workers and vulnerable populations from extreme heat and cold.,"Severe Winter Weather,Extreme Heat",People,"""Health, Wellness, & Security""",Public Health,"Triangle Region, NC Regional Resilience Assessment",https://www.tjcog.org/focus-areas-environment-resilience-climate-and-energy/triangle-regional-resilience-partnership,https://toolkit.climate.gov/case-studies/triangle-region-nc-regional-resilience-assessment-0
Develop mechanisms to alert and protect outdoor workers from increasing temperatures and extreme heat events.,Extreme Heat,People,"""Health, Wellness, & Security""",Public Health,"Cumberland County, NC: Climate Resiliency Plan",,
Develop mutual aid for emergency water supply.,Drought,Water Infrastructure – General,Partnerships & Collaboration,Partnerships,"Triangle Region, NC Regional Resilience Assessment",https://www.tjcog.org/focus-areas-environment-resilience-climate-and-energy/triangle-regional-resilience-partnership,https://toolkit.climate.gov/case-studies/triangle-region-nc-regional-resilience-assessment-0
Develop new policy that requires private property owners to maintain sidewalks or accessible route to property.,Severe Winter Weather,Transportation and Mobility,"""Policy, Codes, & Standards""",Policies,"Triangle Region, NC Regional Resilience Assessment",https://www.tjcog.org/focus-areas-environment-resilience-climate-and-energy/triangle-regional-resilience-partnership,https://toolkit.climate.gov/case-studies/triangle-region-nc-regional-resilience-assessment-0
"Develop or adopt safety guidelines for appropriate and safe graywater use. Within the guidelines, encourage the use of captured stormwater for irrigation and other applicable purposes where non-potable water is sufficient. Graywater is the relatively clean wastewater from other uses, such as from washing machines, bathtubs and sinks. Increasing water use efficiency can prevent or alleviate drought impacts.","Water Quality,Drought","Water Infrastructure – General,Water Infrastructure – Stormwater","""Policy, Codes, & Standards""",Building Codes,State of Louisiana Regional Adaptation Strategy,https://s3.amazonaws.com/lasafe/Final+Adaptation+Strategies/Regional+Adaptation+Strategy.pdf,https://toolkit.climate.gov/case-studies/state-louisiana-regional-adaptation-strategy-0
Develop or reference existing guidelines for substantial rehabilitation and new construction of housing in wildfire hazard areas.,Wildfire,Property,"""Policy, Codes, & Standards""",Building Codes,HUD Community Resilience Toolkit,https://www.hudexchange.info/resource/5981/community-resilience-toolkit/,https://toolkit.climate.gov/case-studies/hud-community-resilience-toolkit-0
Develop or update drought response plans to include historical data water usage and drought projections. Consider whether the existing plan needs to change thresholds or change response options.,Drought,"Water Infrastructure – Drinking Water,Water Infrastructure – General",Planning & Management,Planning,"Planning for Climate Resilience | City of Asheville, North Carolina",https://drive.google.com/file/d/1X_Gr4eUCmkXPOzAcvyxCe-uZPkX84Byz/view,https://toolkit.climate.gov/case-studies/planning-future-floodplain
Develop or update stormwater rules. ,Flooding – General,Water Infrastructure – Stormwater,"""Policy, Codes, & Standards""",Building Codes,Southeast Florida Compact Regional Climate Action Plan - Energy and Fuel,http://www.southeastfloridaclimatecompact.org/recommendation-category/ef/,https://toolkit.climate.gov/case-studies/southeast-florida-compact-regional-climate-action-plan-energy-and-fuel-0
