Option,Hazards,Assets,Action Type,Sub-Action Type,Source Plan,URL,Toolkit Case Study
Plant dense vegetation along riparian corridors to create a buffer from intensely flowing waters during floods.,"Flooding – Coastal,Flooding – General","Urban Landscape and Tree Canopy,Water Infrastructure – Wastewater,Natural Areas and Wildlife",Capital Improvements - Green & Gray Infrastructure,"""Nature-based solutions, Green Infrastructure""",City of Baltimore Disaster Preparedness and Planning Project,https://www.baltimoresustainability.org/wp-content/uploads/2019/10/2018-DP3-For-Print.pdf,https://toolkit.climate.gov/case-studies/city-baltimore-disaster-preparedness-and-planning-project-1
Plant fire-resistant vegetation and create fire breaks by managing brush and other fire fuel. ,Wildfire,"Agriculture and Food Supply,Aquatic and Marine Resources,Natural Areas and Wildlife",Preparedness & Response,Prescribed Fire & Fuel Management,HUD Community Resilience Toolkit,https://www.hudexchange.info/resource/5981/community-resilience-toolkit/,https://toolkit.climate.gov/case-studies/hud-community-resilience-toolkit-0
Plant native vegetation in the buffer around lakes to help maintain their ecological health and water quality.,Water Quality,"Water Infrastructure – Wastewater,Natural Areas and Wildlife",Capital Improvements - Green & Gray Infrastructure,"""Nature-based solutions, Green Infrastructure""","West Palm Beach, FL - Rethink Paradise: Sustainability Action Plan",https://www.wpb.org/home/showpublisheddocument/7079/638446312959930000,https://toolkit.climate.gov/case-studies/west-palm-beach-fl-rethink-paradise-sustainability-action-plan-1
Plant shoreline vegetation in the coastal zone to assist in dissipation of the wind and breaking waves. ,Erosion and Shoreline Recession,Natural Areas and Wildlife,Funding & Finance,Financing & Incentives,HUD Community Resilience Toolkit,https://www.hudexchange.info/resource/5981/community-resilience-toolkit/,https://toolkit.climate.gov/case-studies/hud-community-resilience-toolkit-0
Plant trees or construct shade structures for livestock.,Extreme Heat,Agriculture and Food Supply,Capital Improvements - Green & Gray Infrastructure,"""Nature-based solutions, Green Infrastructure""",Statewide Summary Report: California's Fourth Climate Change Assessment,https://resilientca.org/ ,https://toolkit.climate.gov/case-studies/statewide-summary-report-californias-fourth-climate-change-assessment-1
Prepare agreements with government or nongovernmental partners to truck water in before the need occurs. Ensure agreement terms are adequate given the projected frequency of severe drought events.,Drought,Water Infrastructure – Drinking Water,Capacity Building,Governance Capacity Building,"Planning for Climate Resilience | City of Asheville, North Carolina",https://drive.google.com/file/d/1X_Gr4eUCmkXPOzAcvyxCe-uZPkX84Byz/view,https://toolkit.climate.gov/case-studies/planning-future-floodplain
Prepare geohazard designation mapping. Use these maps to update zoning codes and building regulations.,"Landslides,Erosion and Shoreline Recession",Property,Capacity Building,"""Data Collection, Analysis, Research, Assess Vulnerability & Risk""",Juneau's Changing Climate and Community Response,https://acrc.alaska.edu/docs/juneau-climate-report,https://toolkit.climate.gov/case-studies/juneaus-changing-climate-and-community-response-1
Preservation of open space in flood prone areas,Flooding – Rainfall-induced,Natural Areas and Wildlife,"""Land Use, Land Conservation, & Zoning""",Land Use Practice,"Planning for Climate Resilience | City of Asheville, North Carolina",https://drive.google.com/file/d/1X_Gr4eUCmkXPOzAcvyxCe-uZPkX84Byz/view,https://toolkit.climate.gov/case-studies/planning-future-floodplain
Preserve undeveloped and vulnerable shoreline.,"Erosion and Shoreline Recession,Flooding – Coastal","Aquatic and Marine Resources,Natural Areas and Wildlife","""Land Use, Land Conservation, & Zoning""",Land Use Practice,Statewide Summary Report: California's Fourth Climate Change Assessment,https://resilientca.org/ ,https://toolkit.climate.gov/case-studies/statewide-summary-report-californias-fourth-climate-change-assessment-1
Prevent building new roads in flood-prone areas. ,Flooding – General,Transportation and Mobility,,,"Triangle Region, NC Regional Resilience Assessment",https://www.tjcog.org/focus-areas-environment-resilience-climate-and-energy/triangle-regional-resilience-partnership,https://toolkit.climate.gov/case-studies/triangle-region-nc-regional-resilience-assessment-0
Prioritize fuel supply routes to mitigate fuel shortage due to outside event.,Multiple or All Hazards,Transportation and Mobility,Planning & Management,"""Redundancy of routes, adaptive capacity""","Planning for Climate Resilience | City of Asheville, North Carolina",https://drive.google.com/file/d/1X_Gr4eUCmkXPOzAcvyxCe-uZPkX84Byz/view,https://toolkit.climate.gov/case-studies/planning-future-floodplain
"Prioritize road treatment to streets and sidewalks to increase access to critical facilities (e.g., hospitals, emergency medical services, police and fire stations, food suppliers).",Severe Winter Weather,"Transportation and Mobility,Critical Facilities",Planning & Management,Planning,"Triangle Region, NC Regional Resilience Assessment",https://www.tjcog.org/focus-areas-environment-resilience-climate-and-energy/triangle-regional-resilience-partnership,https://toolkit.climate.gov/case-studies/triangle-region-nc-regional-resilience-assessment-0
"Prioritize the proper function of transit, transportaiton, and mobility access  points for socially vulnerable populations before, during, and after climate-related events.",Severe Winter Weather,People,Capacity Building,"""Data Collection, Analysis, Research, Assess Vulnerability & Risk""","Triangle Region, NC Regional Resilience Assessment",https://www.tjcog.org/focus-areas-environment-resilience-climate-and-energy/triangle-regional-resilience-partnership,https://toolkit.climate.gov/case-studies/triangle-region-nc-regional-resilience-assessment-0
"Prioritize urban heat island mitigation strategies in transportation corridors to reduce the impacts of extreme heat on roads (e.g., trees, green roofs for buildings in transportation corridors, painting roofs white to absorb heat and light).",Extreme Heat,"Transportation and Mobility,Urban Landscape and Tree Canopy",Capital Improvements - Green & Gray Infrastructure,Enhance Pavement,"Triangle Region, NC Regional Resilience Assessment",https://www.tjcog.org/focus-areas-environment-resilience-climate-and-energy/triangle-regional-resilience-partnership,https://toolkit.climate.gov/case-studies/triangle-region-nc-regional-resilience-assessment-0
Proactive maintanence of stormwater infrastructure.,Flooding – Rainfall-induced,Water Infrastructure – Stormwater,Capital Improvements - Green & Gray Infrastructure,Stormwater Infrastructure,"Triangle Region, NC Regional Resilience Assessment",https://www.tjcog.org/focus-areas-environment-resilience-climate-and-energy/triangle-regional-resilience-partnership,https://toolkit.climate.gov/case-studies/triangle-region-nc-regional-resilience-assessment-0
"Proactively create, protect and restore native vegetation communities and species habitat to provide ecosystem services on local government properties (including parks, open spaces and other public properties).","""Shifting Species, Habitats, and Ecosystems""","Urban Landscape and Tree Canopy,Water Infrastructure – Wastewater,Natural Areas and Wildlife,Property",Capital Improvements - Green & Gray Infrastructure,"""Nature-based solutions, Green Infrastructure""",Boise's Climate Action Roadmap,https://www.cityofboise.org/media/18146/boise-climate-roadmap.pdf,https://toolkit.climate.gov/case-studies/boises-climate-action-roadmap
Promote and leverage existing policies and programs designed to reduce flood risks and economic losses. Promote  local mitigation strategy activities and the Federal Emergency Management Agency National Flood Insurance Program Community Rating System.,Flooding – General,Economy,"""Policy, Codes, & Standards""",Policies,Southeast Florida Compact Regional Climate Action Plan - Energy and Fuel,http://www.southeastfloridaclimatecompact.org/recommendation-category/ef/,https://toolkit.climate.gov/case-studies/southeast-florida-compact-regional-climate-action-plan-energy-and-fuel-0
Promote and support sustainable practices in all areas of the food system. The food economy is an integral contributor to the overall economic vitality of the City.,Drought,Agriculture and Food Supply,Capacity Building,"""Community Resources, Transformative Strategies, Resilience Hubs""","Phoenix, AZ Climate Action Plan",https://www.phoenix.gov/oepsite/Documents/2021ClimateActionPlanEnglish.pdf,https://toolkit.climate.gov/case-studies/phoenix-az-climate-action-plan-1
Promote diverse economic opportunities that are responsive to changes in available natural resources.,Multiple or All Hazards,"Economy,Natural Areas and Wildlife",Funding & Finance,Economic Development,Statewide Summary Report: California's Fourth Climate Change Assessment,https://resilientca.org/ ,https://toolkit.climate.gov/case-studies/statewide-summary-report-californias-fourth-climate-change-assessment-1
"Promote drought-tolerant plant species or other landscaping strategies to reduce dependence on irrigation (i.e., xeriscaping). ",Drought,Property,Capital Improvements - Green & Gray Infrastructure,"""Nature-based solutions, Green Infrastructure""",HUD Community Resilience Toolkit,https://www.hudexchange.info/resource/5981/community-resilience-toolkit/,https://toolkit.climate.gov/case-studies/hud-community-resilience-toolkit-0
Promote fire safe landscaping practices for residential and commercial development.,Wildfire,"Urban Landscape and Tree Canopy,Critical Facilities,Property",Capital Improvements - Green & Gray Infrastructure,Adaptive Capacity of Buildings,Statewide Summary Report: California's Fourth Climate Change Assessment,https://resilientca.org/ ,https://toolkit.climate.gov/case-studies/statewide-summary-report-californias-fourth-climate-change-assessment-1
"Promote green infrastructure (GI) for residential, commercial and golf course properties. Encourage GI installations such as wetlands, supply canals and lakes, green roofs, rain barrels and trees. GI helps manage stormwater on site, can improve water quality, can help protect coastal areas and offers cooling benefits when it is hot outside.",Water Quality,Property,Public Education & Outreach,Community Engagement,"West Palm Beach, FL - Rethink Paradise: Sustainability Action Plan",https://www.wpb.org/home/showpublisheddocument/7079/638446312959930000,https://toolkit.climate.gov/case-studies/west-palm-beach-fl-rethink-paradise-sustainability-action-plan-1
"Promote opportunities for controlled-environment agriculture (e.g., hydroponics, aquaculture) to increase local food production of food that is less energy and water intensive and protected from climate extremes.","Changing Seasons,Drought","Agriculture and Food Supply,Economy","""Health, Wellness, & Security""",Food Security,"City of San Antonio, TX: A Path for Climate Action & Adaptation",https://www.sanantonio.gov/Portals/0/Files/Sustainability/SAClimateReady/SACRReportOctober2019.pdf,https://toolkit.climate.gov/case-studies/city-san-antonio-tx-path-climate-action-adaptation-1
"Promote or require site and building design standards to minimize erosion risk. For example, encourage the construction of open foundation systems on buildings that allow water to pass beneath or through the foundation. This strategy minimizes scour and localized loss of soil. ",Erosion and Shoreline Recession,Property,Capital Improvements - Green & Gray Infrastructure,Adaptive Capacity of Buildings,HUD Community Resilience Toolkit,https://www.hudexchange.info/resource/5981/community-resilience-toolkit/,https://toolkit.climate.gov/case-studies/hud-community-resilience-toolkit-0
Promote regenerative soil building to revitalize soil quality. ,Drought,Agriculture and Food Supply,Public Education & Outreach,Community Engagement,"Missoula, MT Regional Adaptation Strategy",https://www.climatereadymissoula.org/uploads/1/2/6/6/126687164/revisedclimatereadymissoula_2.22.20.pdf,https://toolkit.climate.gov/case-studies/missoula-mt-regional-adaptation-strategy-0
"Promote resilient land management practices, including range management practices that increase water retention. Increased water retention can enhance soil moisture, ground water and healthy ecosystems. One example is water-smart livestock grazing. ",Drought,"Agriculture and Food Supply,Aquatic and Marine Resources,Natural Areas and Wildlife","""Land Use, Land Conservation, & Zoning""",Land Use Practice,"County of Santa Clara, CA Climate Adaptation Guidebook",https://sustainability.sccgov.org/sites/g/files/exjcpb976/files/documents/1_150803_Final%20Guidebook_W_Appendices.pdf,https://toolkit.climate.gov/case-studies/county-santa-clara-ca-climate-adaptation-guidebook-1
Promote the city’s water service line insurance program. ,Drought,Water Infrastructure – Drinking Water,Public Education & Outreach,Education,"Spearfish, SD Climate Resiliency Plan",https://www.bhsu.edu/Faculty-Staff/Campus-Services/Facilities-Services/Sustainability/_docs/climate-resiliency-plan-2020.pdf,https://toolkit.climate.gov/case-studies/spearfish-sd-climate-resiliency-plan-0
Promote the development of flexible indoor recreation and tourism opportunities that work in different seasons or weather conditions.,Changing Seasons,Economy,Planning & Management,Design and alternative designs,"Missoula, MT Regional Adaptation Strategy",https://www.climatereadymissoula.org/uploads/1/2/6/6/126687164/revisedclimatereadymissoula_2.22.20.pdf,https://toolkit.climate.gov/case-studies/missoula-mt-regional-adaptation-strategy-0
"Promote the development of green infrastructure and alternative, net-zero greenhouse gas emission strategies for water supply, stormwater, and water infrastructure - Wastewater management focused on achieving a balance between water availability and consumption, limiting energy use to the amount produced on-site via renewable energy, and eliminating solid waste sent to landfills. Create comprehensive strategies to advance the multiple benefits and sustainability of services provided by net-zero practices.",Flooding – General,Water Infrastructure – General,Capital Improvements - Green & Gray Infrastructure,"""Nature-based solutions, Green Infrastructure""",Southeast Florida Compact Regional Climate Action Plan - Energy and Fuel,http://www.southeastfloridaclimatecompact.org/recommendation-category/ef/,https://toolkit.climate.gov/case-studies/southeast-florida-compact-regional-climate-action-plan-energy-and-fuel-0
"Promote the increased agility of existing tourism and recreational businesses to adapt to changing seasons (i.e., flexible timing and location of activities).",Changing Seasons,Economy,Partnerships & Collaboration,Partnerships,"Missoula, MT Regional Adaptation Strategy",https://www.climatereadymissoula.org/uploads/1/2/6/6/126687164/revisedclimatereadymissoula_2.22.20.pdf,https://toolkit.climate.gov/case-studies/missoula-mt-regional-adaptation-strategy-0
Promote the proactive replacement of declining ash trees with a diverse mix of species to build urban forest resiliency and maintain canopy cover.,"""Shifting Species, Habitats, and Ecosystems""",Urban Landscape and Tree Canopy,Public Education & Outreach,Education,"St Paul, MN Climate Action & Resilience Plan",https://www.stpaul.gov/sites/default/files/Media%20Root/Mayor%27s%20Office/Saint%20Paul%20Climate%20Action%20%26%20Resilience%20Plan.pdf,https://toolkit.climate.gov/case-studies/st-paul-mn-climate-action-resilience-plan-1
Promote the protection and restoration of coastal natural systems and the creation of living shorelines at the regional scale. ,"Erosion and Shoreline Recession,Flooding – Coastal","Water Infrastructure – Wastewater,Natural Areas and Wildlife",Capital Improvements - Green & Gray Infrastructure,"""Nature-based solutions, Green Infrastructure""",Southeast Florida Compact Regional Climate Action Plan - Energy and Fuel,http://www.southeastfloridaclimatecompact.org/recommendation-category/ef/,https://toolkit.climate.gov/case-studies/southeast-florida-compact-regional-climate-action-plan-energy-and-fuel-0
"Promote the reuse of stormwater by implementing capture and reuse technologies in county and municipal operations, where feasible. ",Drought,Water Infrastructure – Stormwater,Capital Improvements - Green & Gray Infrastructure,Water Infrastructure,Climate Resilient San Diego,https://www.sandiego.gov/sites/default/files/crsd_final_plan_with_appendices.pdf,https://toolkit.climate.gov/case-studies/climate-resilient-san-diego-1
"Promote the values of planting future climate adapted tree species and crops in an effortto expand tree planting efforts on private land. Thereby promoting restoration efforts toreforest riparian areas, wetland buffers, and unhealthy soil.","""Shifting Species, Habitats, and Ecosystems""",People,Public Education & Outreach,Community Engagement,Vermont Climate Action Plan,https://outside.vermont.gov/agency/anr/climatecouncil/Shared%20Documents/Initial%20Climate%20Action%20Plan%20-%20Final%20-%2012-1-21.pdf,https://toolkit.climate.gov/case-studies/vermont-climate-action-plan-1
Promote water conservation and water reuse in local businesses and industry. Increasing water use efficiency can prevent or alleviate drought impacts.,Drought,"Water Infrastructure – Drinking Water,Property",Public Education & Outreach,Community Engagement,Climate Resilient San Diego,https://www.sandiego.gov/sites/default/files/crsd_final_plan_with_appendices.pdf,https://toolkit.climate.gov/case-studies/climate-resilient-san-diego-1
Promote water conservation through updates to municipal irrigation systems.  ,Drought,Water Infrastructure – Drinking Water,Capital Improvements - Green & Gray Infrastructure,Water Infrastructure,Climate Resilient San Diego,https://www.sandiego.gov/sites/default/files/crsd_final_plan_with_appendices.pdf,https://toolkit.climate.gov/case-studies/climate-resilient-san-diego-1
Promote wider communication on Air Quality alerts.,Air Quality,Critical Facilities,"""Policy, Codes, & Standards""",Building Codes,"West Palm Beach, FL - Rethink Paradise: Sustainability Action Plan",https://www.wpb.org/home/showpublisheddocument/7079/638446312959930000,https://toolkit.climate.gov/case-studies/west-palm-beach-fl-rethink-paradise-sustainability-action-plan-1
Promote wider communication on air quality alerts.,"Air Quality,Wildfire","People,Critical Facilities","Public Education & Outreach,""Policy, Codes, & Standards""","Communications,Building Codes","West Palm Beach, FL - Rethink Paradise: Sustainability Action Plan, Triangle Region, NC Regional Resilience Assessment",,
"Protect mechanical, electrical and other key operational equipment from flooding at critical facilities through facility improvements or adaptive action.  ","Flooding – Coastal,Flooding – General",Critical Facilities,Capital Improvements - Green & Gray Infrastructure,"""Armoring, harden, retrofits and revetments""",Climate Resilient San Diego,https://www.sandiego.gov/sites/default/files/crsd_final_plan_with_appendices.pdf,https://toolkit.climate.gov/case-studies/climate-resilient-san-diego-1
"Protect parks and facilities from the increased risk of urban and rural fire through increased underbrush clearing, perimeter protection and adequate patrol and staffing. ",Wildfire,"Urban Landscape and Tree Canopy,Aquatic and Marine Resources,Natural Areas and Wildlife,Property",Preparedness & Response,Prescribed Fire & Fuel Management,"City of Santa Cruz, CA Climate Action Plan",https://www.cityofsantacruz.com/home/showdocument?id=23644,https://toolkit.climate.gov/case-studies/city-santa-cruz-ca-climate-action-plan-1
Protect surface and groundwater from contamination.,Water Quality,Water Infrastructure – Stormwater,Capital Improvements - Green & Gray Infrastructure,Water Infrastructure,Climate Action Plan for the Chicago Region,https://mayorscaucus.org/wp-content/uploads/2021/06/RegionalCAP_primary_and_appendices_062321-02.pdf,https://toolkit.climate.gov/case-studies/climate-action-plan-chicago-region-1
"Protect, maintain and enhance connected habitat corridors. ","""Shifting Species, Habitats, and Ecosystems""","Urban Landscape and Tree Canopy,Aquatic and Marine Resources,Natural Areas and Wildlife",Capital Improvements - Green & Gray Infrastructure,"""Nature-based solutions, Green Infrastructure""","Missoula, MT Regional Adaptation Strategy",https://www.climatereadymissoula.org/uploads/1/2/6/6/126687164/revisedclimatereadymissoula_2.22.20.pdf,https://toolkit.climate.gov/case-studies/missoula-mt-regional-adaptation-strategy-0
"Protect, maintain and expand the urban tree canopy.","Air Quality,Extreme Heat,Flooding – General",Urban Landscape and Tree Canopy,Capital Improvements - Green & Gray Infrastructure,"""Nature-based solutions, Green Infrastructure""",Southeast Florida Compact Regional Climate Action Plan - Energy and Fuel,http://www.southeastfloridaclimatecompact.org/recommendation-category/ef/,https://toolkit.climate.gov/case-studies/southeast-florida-compact-regional-climate-action-plan-energy-and-fuel-0
Provide budget billing and deferred payment plans for families impacted by extreme events.,"High Winds,Landslides,Multiple or All Hazards,Severe Winter Weather,Wildfire,Erosion and Shoreline Recession,Extreme Heat,Flooding – Coastal,Flooding – General",People,Funding & Finance,Financing & Incentives,Tallahassee Community Resilience Plan,https://www.talgov.com/uploads/public/documents/publicsafety/resplansm.pdf,https://toolkit.climate.gov/case-studies/tallahassee-community-resilience-plan-1
Provide cooling systems for municipal and county assets and equipment sensitive to overheating. ,Extreme Heat,Critical Facilities,Capital Improvements - Green & Gray Infrastructure,Adaptive Capacity of Buildings,Climate Resilient San Diego,https://www.sandiego.gov/sites/default/files/crsd_final_plan_with_appendices.pdf,https://toolkit.climate.gov/case-studies/climate-resilient-san-diego-1
Provide education and training for smaller health clinics on infectious diseases and the link of increased disease incidence to climate threats.,Vector-Borne Disease,"Critical Facilities,People",Public Education & Outreach,Education,"Triangle Region, NC Regional Resilience Assessment",https://www.tjcog.org/focus-areas-environment-resilience-climate-and-energy/triangle-regional-resilience-partnership,https://toolkit.climate.gov/case-studies/triangle-region-nc-regional-resilience-assessment-0
Provide emergency service staff information about where vulnerable populations are located.,"High Winds,Severe Winter Weather,Extreme Cold,Extreme Heat",People,Public Education & Outreach,Education,"Triangle Region, NC Regional Resilience Assessment",https://www.tjcog.org/focus-areas-environment-resilience-climate-and-energy/triangle-regional-resilience-partnership,https://toolkit.climate.gov/case-studies/triangle-region-nc-regional-resilience-assessment-0
"Provide financial assistance for low-income residents to help with power bills, energy upgrades to homes and apartments and support services during extended periods of high temperature.",Extreme Heat,People,Funding & Finance,Financing & Incentives,"Cumberland County, NC: Climate Resiliency Plan",,
"Provide financial or process incentives for compact development near transit, especially those that prioritize affordable housing. ",Air Quality,Transportation and Mobility,Funding & Finance,Economic Development,Boise's Climate Action Roadmap,https://www.cityofboise.org/media/18146/boise-climate-roadmap.pdf,https://toolkit.climate.gov/case-studies/boises-climate-action-roadmap
"Provide incentives (density bonuses, permitting fees, faster review process, etc.) to developers to reduce impervious surfaces beyond riparian buffer rules and leave riparian areas in place.","Flooding – General,Flooding – Rainfall-induced","Property,Water Infrastructure – Stormwater",Funding & Finance,Financing & Incentives,"Triangle Region, NC Regional Resilience Assessment",https://www.tjcog.org/focus-areas-environment-resilience-climate-and-energy/triangle-regional-resilience-partnership,https://toolkit.climate.gov/case-studies/triangle-region-nc-regional-resilience-assessment-0
"Provide incentives for projects that restore or create marine coastal habitat areas (e.g., beaches, dunes, wetlands) to minimize coastal erosion. ",Erosion and Shoreline Recession,"Water Infrastructure – Wastewater,Natural Areas and Wildlife",Funding & Finance,Financing & Incentives,HUD Community Resilience Toolkit,https://www.hudexchange.info/resource/5981/community-resilience-toolkit/,https://toolkit.climate.gov/case-studies/hud-community-resilience-toolkit-0
"Provide incentives for proper shoreline stabilization and bank stabilization methods, including sloping or grading techniques, terracing hillsides or installing riprap boulders or geotextile fabric. ",Erosion and Shoreline Recession,"Aquatic and Marine Resources,Natural Areas and Wildlife",Funding & Finance,Financing & Incentives,HUD Community Resilience Toolkit,https://www.hudexchange.info/resource/5981/community-resilience-toolkit/,https://toolkit.climate.gov/case-studies/hud-community-resilience-toolkit-0
Provide information to homeowners about statutory vegetation management requirements and promote fuel breaks to slow fire spread in forested and WUI areas,Wildfire,Property,Public Education & Outreach,Education,Statewide Summary Report: California's Fourth Climate Change Assessment,https://resilientca.org/ ,https://toolkit.climate.gov/case-studies/statewide-summary-report-californias-fourth-climate-change-assessment-1
